id,source_file,source_pages,source_ref,strategy_name,concept,market,timeframe,session,rules_completeness,eligibility,eligibility_reason,dedup_cluster,overlaps_existing,priority_hint,status,notes
STR-088,ff_932507_4x25ma-simple-strategy.pdf,"1,5","foff00, ""4x25MA Simple Strategy,"" Forex Factory thread 932507 (year not stated in thread; MT4-era), https://www.forexfactory.com/thread/932507",4x25MA MTF EMA-Alignment Trend,"Go long only when price closes above the 25 EMA on all four timeframes (M15, H1, H4, D1) simultaneously, riding confirmed multi-timeframe trend agreement with ATR-scaled stop and target.",FX,H4,London,FULL,ELIGIBLE,"Pure-MQL5 deterministic MTF 25-EMA trend with ATR(14) SL=2xATR / TP=3-4xATR on FX majors and JPY crosses; all data via .DWX, FTMO/DXZ-compatible with a defined stop.",,,MED,NEW,"Entry: price above 25 EMA on M15+H1+H4+D1 with 1-3 closed bars (shorts mirror). Exit: SL 2xATR, TP 3-4xATR (ATR timeframe unstated, presumably H4). Session filter: enter only after London open, not after NY close (London-through-NY window). Author later tested an M15 scalper variant with trailing-stop-only (original had NO SL) - anecdotal forward-test evidence only, no rigorous backtest. Secondary reference in-thread: reteid2222 'Strategy I: 3 EMAs with trend filter' links external site forexmt4indicators.com plus NRTR_ATR_STOP.ex4 - rules not stated in thread, not classified. Much of thread (pages 8-17) is off-topic drama about a 'MACD Sample' .ex4 flagged as malware/HTML payload - ignore; not a strategy. Low source reputability (anonymous forum, weak evidence) caps priority."
STR-089,ff_97002_close-all-trades-with-a-push-of-a.pdf,1,"""Close all trades with a push of a button?"" by simple4x, ForexFactory Thread 97002 (2 posts), https://www.forexfactory.com/thread/97002",Close-all-trades button (utility request),A user simply asks for an MT4 script/hotkey to close all open positions at once while in profit — no trading edge is described.,FX,M1,none,VAGUE,REJECTED,"No trading edge or entry/exit rules; thread is a request for a close-all-positions utility button, not a strategy.",,,LOW,NEW,"Two-post thread; second post ('ForexPower: Here.') just links a script. Trade-management tooling, not a mechanizable strategy."
STR-090,ff_989445_magic-100.pdf,1-12,"""Magic 100"" EMA-100 trend-continuation pullback system, thread started by user Minotawr (with rule clarifications by xkwisit2001), ForexFactory thread 989445, first 3 pages / 60 posts, n.d. (approx. 2021-2023). https://www.forexfactory.com/thread/989445-magic-100",Magic 100 EMA Pullback Breakout,"Trend-continuation: in the direction of a 100EMA-defined trend, place a pending stop order just past the last counter-trend retracement candle (SL at that candle's opposite extreme, TP=2R), rolling the pending order to each new retrace candle until triggered.",FX,H1,London,PARTIAL,ELIGIBLE,"Deterministic pure-MQL5 pending-stop breakout with EMA100 trend filter, hard SL at candle extreme and 2R TP (FTMO/DXZ-compatible); FX-major H1 data available via .DWX.",,,LOW,NEW,"Core mechanic well-specified (EMA100 direction; buy-stop above / sell-stop below the retracement candle 'just the spread away'; SL at the same candle's low/high; TP 2R at ~1:2-1:3; roll the pending order to each newer retrace candle on close until filled; 1 trade/day/pair, major pairs, Frankfurt+London session). PARTIAL because the load-bearing 'strong trend vs sideways = don't trade' filter and 'which retracement candle' are discretionary/unquantified (mechanizable via EMA100 slope + first-opposite-color-close). Generic EMA-pullback archetype; anonymous beginner-oriented FF thread with no backtest evidence -> low priority. Variants mentioned: HTF confirmation (4H/D1 trend, 1H entry) and applying on D1/H4 directly; treated as parameterizations of the same core."
STR-091,ff_993524_roadmap-a-way-to-read-markets.pdf,"1-5, 18-19","LauraT, 'Roadmap - A Way To Read Markets', ForexFactory thread 993524 (2020), https://www.forexfactory.com/thread/993524-roadmap-a-way-to-read-markets",Roadmap 8EMA-Channel vs SMA200 Trend-Pullback,"When an 8-EMA high/low channel sits fully above (below) the SMA200 the bias is long (short), and you enter on price pulling back to the opposite channel band, filtered by a composite multi-timeframe RSI>50/<50 and an SMA200 multi-timeframe dashboard, exiting at prior-day high/low or the daily-open line.",FX,M15,none,PARTIAL,ELIGIBLE,"Entry skeleton (channel-vs-SMA200 bias + pullback-to-band + RSI/MTF filters) is mechanizable in pure MQL5 with available data, but stops/exits are only heuristic and the author states human judgement is essential and her own automation attempts failed to replicate performance.",,,LOW,NEW,"Discretionary indicator suite, not an algo; OP explicitly says she tried twice with skilled coders and could not automate it. Two named setups fold into this one core: (1) 'channel trade' = pullback entry after channel fully crosses SMA200; (2) 'channel failure' = channel pokes past SMA200 then falls back, treated as higher-probability reversal entry (same execution: wait for channel on one side, enter when price reaches opposite band). Instrument/TF-agnostic in the thread: she trades M1 for indices (Dow) and oil, M5/M15 for FX crosses (GBPUSD, EURAUD), also H4/D1; representative M15/FX chosen for the row. Filters: composite RSI = RSI2/RSI9 blended across W1/D1/H4 (>50 bullish); MTF dashboard wants >=2 relevant-TF SMA200 readings agreeing. Exits vague: prior-day High/Low, daily-open line (broker-midnight, CET), or discretionary 'take profit on spikes'; no fixed SL stated. Advanced ADR-locked reversal element mentioned but deferred with no rules. Generic MA-channel trend-pullback with no uncorrelated return driver -> low value; exits would need framework redesign (cf. T-WIN/Balke 'edge real, exits amputate' pattern)."
STR-092,ff_993609_the-finance-book-club.pdf,1-192,"clemmo17, 'The Finance Book Club', ForexFactory thread 993609, 2019-2020, https://www.forexfactory.com/thread/993609/the-finance-book-club",n/a (book-review / course-summary meta-thread),A running review of ~30 trading books plus Coursera (Shiller 'Financial Markets') and Tickmill (Munnelly) course notes; it argues trading philosophy and critiques technical analysis rather than specifying any complete mechanical system.,FX,n/a,none,VAGUE,REJECTED,"No source in the thread presents a complete deterministic entry+exit+param system; it is book reviews, course notes and TA-skepticism. The closest concrete content is generic textbook TA the summarizer explicitly dismisses.",,,LOW,NEW,"In-depth sections: Mark Tier '23 habits', Shiller Coursera notes (portfolio/CAPM/behavioral finance), Taleb 'Fooled by Randomness', Munnelly Tickmill course, Aronson 'Evidence-Based TA'. The Aronson review's own conclusion is that ~6400 data-mined binary S&P500 buy/sell rules fail significance testing (upward bias) - an anti-strategy result. Munnelly's only quasi-rules: Bollinger-band 'fade' of the outer band in a low-volatility London session (mean reversion) and a pullback-to-MA trend continuation in high vol - both stated without parameters/vol thresholds and dismissed by clemmo as 'traditional TA garbage'. Munnelly money-management scheme (80-pip stop, 160-pip TP, scale out 2/3, trail final third +80 pips) is position management, not an entry edge. Books with reputed concrete systems (Alan Hull 'Trade My Way', Naked Forex 'Big Shadow', Owens&Lizotte, Jeff Cooper 'Hit and Run', Trader Vic 2B) appear only in the graded table of contents with no rule write-up. Nothing implementable harvested."
STR-093,forex-sma-20151009.html.pdf,1,"Intended source: babypips.com forex SMA page (captured 2015-10-09), per filename forex-sma-20151009.html.pdf. Captured content is a Cloudflare 'Sorry, you have been blocked / You are unable to access babypips.com' interstitial (Cloudflare Ray ID a1fad7e2185211d5), not the article body.",n/a - blocked capture,No strategy content present; the saved page is a Cloudflare access-denied block page rather than the intended babypips SMA article.,FX,M1,none,VAGUE,REJECTED,"Captured PDF contains only a Cloudflare block page, no strategy rules or edge to harvest.",,,LOW,NEW,"Readable text, not image-only, but zero usable content. If a re-fetch of the babypips SMA article is desired, retrieve via a non-blocked path; generic single-SMA crossover material is typically low-value regardless."
STR-094,forex-system-20150605.html.pdf,1,"Robopip, ""Forex Mechanical System: SMA Crossover Pullback"", babypips.com Trading Systems, June 5, 2015 (based on Big Pippin's Daily Chart Art framework). URL approx https://www.babypips.com/trading-systems/forex-mechanical-system-sma-crossover-pullback",SMA Crossover Pullback (Big Pippin),"Trade in the direction of the 100/200 SMA trend and time entries on a stochastic (14,3,3) pullback back into that trend.",FX,D1,none,PARTIAL,ELIGIBLE,"Pure-MQL5 dual-SMA trend filter + stochastic pullback entry, deterministic, no ML, FX data available; but this HTML snapshot is truncated by a cookie-consent overlay so precise entry trigger, exit and SL/TP are missing.",,,LOW,NEW,"Only the intro survived the page capture: indicators = 100 & 200 SMA + Stochastic (14,3,3); direction from SMA crossover, entry on stochastic pullback. Generic MA-crossover trend-follow (heavily arbitraged retail template, contradicts FX-edge doctrine). Timeframe D1 inferred from 'Daily Chart Art'. Full rules would need reconstruction from the original babypips article."
STR-095,forexfactory_1184099_simple-system_p1-3.pdf,1-4,"sharpiemomo, ""Simple System"", ForexFactory thread 1184099, year n.d. (archived 2026-07-24), https://www.forexfactory.com/thread/1184099-simple-system",APB Heiken-Ashi Color-Flip NY-Open Reversal Scalp (US30),"Enter on the first opposite-color APB (modified Heiken-Ashi) bar close during the NY open on US30, stopping at the prior momentum extreme, to capitalize on price rejections at tops/bottoms.",Indices,M5,NY,PARTIAL,ELIGIBLE,"Entry+stop are mechanical (first opposite modified-HA close, stop at prior swing extreme, US30 NY 09:30-12:00 EST) and testable on WS30 M5/M15 .DWX data; exit is fully discretionary ('no TP rule', fast partials ~0.5RR, scratch runners) and must be mechanized (opposite-flip or session-flat) before backtest.",,,LOW,NEW,"APB = modified Heiken-Ashi indicator (APB.mq4/.ex4 attached, MT4). Single discretionary scalp system, not multiple strategies. Author frames it as only a 'marginal edge' relying on discretionary 'Risk Per Click' sizing (1-4 clicks, non-%; replace with RISK_FIXED). Range-bar variant is not testable in the time-based tester (optional, ignore). Rejected member's TP variant (APB flip touching 5 EMA). Fits session-structure driver rather than swing-MR, but plain HA color-flip is a weak mechanical prior; LOW due to forum source + discretionary exit/sizing core."
STR-096,forexfactory_1394867_vr-gap-open-source-strategy_p1.pdf,1-2,"Voldemar227, 'VR Gap Open Source Trading Strategy', ForexFactory forum thread #1394867, 2026, https://www.forexfactory.com/thread/1394867-vr-gap-open-source-trading-strategy (open-source EA also published on MQL5 Code Base: MT4 https://www.mql5.com/en/code/9994, MT5 https://www.mql5.com/en/code/72239).",VR Gap fade (bar-open gap-fill mean-reversion),"On each new bar, if the gap between the prior bar's close and the current bar's open exceeds a threshold, fade the impulse betting the price returns to close the gap.",Indices,D1,none,FULL,ELIGIBLE,"Deterministic gap-fade fully specified (entry threshold, direction, fixed-point SL, TP=gap size); pure MQL5, no ML, has hard stops so FTMO/DXZ-compatible.",,,MED,NEW,"Entry: at new-bar open, if |prev_close - cur_open| > MinGapSize -> Buy on downward gap, Sell on upward gap; market entry, fixed lot (use RISK_FIXED for backtest). Exit: SL = fixed points from entry; TP dynamic = the gap size itself (target = the level that fully closes the gap). Params: Trading Volume, Minimum Gap Size, Stop Loss Size, Magic/Slippage; no indicators/trend/news filters. Source says any TF/instrument, but real gaps only occur at weekend/session boundaries on continuous .DWX feeds -> best tested as a weekend/session-gap fader (Monday open; index cash gaps); intraday bar-to-bar gaps ~0 on 24h FX. Forum post is essentially an open-source-EA advert -> moderate reputability. Gaps above threshold are rare -> watch Q02 frequency floor (>=5 trades/yr)."
STR-097,forexfactory_340556_swing-trading-heiken-ashi-stochs_p1-3.pdf,1-2,"Hugh Briss, 'Swing trading with heiken ashi and stochs', ForexFactory thread #340556 (posts #1, #20; HA-doji refinement post #22 p8), https://www.forexfactory.com/thread/340556-swing-trading-with-heiken-ashi-and-stochs (anonymous forum author; no verified statistics)",HA + Stoch trend-pullback swing (H4),"Trade in the direction of the 100-SMA trend and enter on a Heiken-Ashi colour flip back into the trend confirmed by a Stochastic (8,3,3) cross out of the pullback extreme.",FX,H4,none,FULL,ELIGIBLE,"Pure-MQL5 (Heiken Ashi, 100 SMA, Stochastic 8,3,3) trend-pullback with fixed 50-pip stop and defined MM exits; deterministic, FX-cross data available via .DWX/DXZ, FTMO/DXZ-compatible.",,,MED,NEW,"One core strategy with three MM/exit variants (ONE row): (1) 50-pip SL, hold until HA flips against trend, trail stop behind price; (2) 50-pip SL + 50-pip TP, SL->+1 after +25 pips; (3) 50-pip SL, take half at +25, remainder to breakeven + trail. Entry rule: price vs 100 SMA = trend filter (long only above / short only below); wait for pullback (HA colour change against trend), HA colour flips back into trend AND stoch cross near the extreme, enter on 4H candle close. Refinement (p8, post #22): HA-doji reversal entry (small body, long wicks both ends after a smooth counter-trend pullback). Discretionary currency-strength filter (post #20) to pick among simultaneous signals; CAD/JPY-vs-oil intermarket musing (post #39-42) is a one-off observation, not mechanical. Anonymous forum author, no verified stats; qualitative 'smooth cross/pullback' language must be mechanized (stoch oversold/overbought thresholds, HA colour-change detection). Covers JPY crosses (e.g. cadjpy). Crowded FX trend-follow archetype -> MED."
STR-098,forexfactory_423512_best-trading-system-only-momentum_p1-4.pdf,1-5,"muhiuddin, ""Best Trading System (Only Momentum)"" / MOMENTUM PRICE SYSTEM, ForexFactory forum thread #423512 (n.d., archived 2026-07-24), https://www.forexfactory.com/thread/423512-best-trading-system-only-momentum",Momentum Divergence Reversal (28-period),Reversal at momentum exhaustion: enter against price when the Momentum(28) indicator diverges from price and then breaks its own prior swing extreme (point F).,FX,H4,none,PARTIAL,ELIGIBLE,"Momentum divergence + momentum-swing-break trigger, price-based stop (point C) and measured-move TPs are mechanizable in pure MQL5 (pivot-lookback divergence detection); no ML/external runtime; FX/JPY/crude data available; defined stops = FTMO/DXZ compatible.",,,MED,NEW,"Rules: Momentum period 28 (close), divergence drawn over 8-28 bars; SHORT = price higher-high while momentum lower-high (mark highest price C, lowest momentum F); enter on close when F penetrated with 2 lots; SL at price C; TP1 = |C - entry| (exit 1 lot, SL->BE); TP2 = 2xTP1 (trail 50% of profit); TP3 = 4xTP1; LONG is the mirror. Divergence-line identification is subjective and must be parameterized (pivot lookback) to be deterministic -> PARTIAL. Evidence is forum anecdote only: author self-reports 3.5-10%/month with 32% DD over 11 months, forward-tested, no backtest; one member reported very few H4 signals. Author claims it works on all FX pairs incl. JPY crosses (CADJPY/GBPJPY examples) and crude oil (XTIUSD in our universe), untested on gold/silver; H4-D1 swing (avg hold ~4 days). Variants mentioned in thread (same core concept, not separate rows): CCI14 divergence on M15/H1 (PAMPAQ #51), and homealbum's vague EMA(21,8)+Bollinger 'price action' comment (#56) too vague to build. A community MT4 divergence indicator (Momentum Divergence2_mtf+alerts.mq4) was attached, confirming the divergence detection is automatable."
STR-099,forexfactory_972324_recommended-strategies-real-traders_p1.pdf,1-2,"scherzi et al., ""Recommended Strategies on Forex Factory - Real Traders"", Forex Factory forum thread #972324, https://www.forexfactory.com/thread/972324-recommended-strategies-on-forex-factory-real-traders",FF meta-discussion: which threads are actually useful,Meta thread asking real traders which FF threads carry real edge; contains no self-contained rule set of its own.,FX,n/a,none,VAGUE,REJECTED,"No implementable rules in this document; only a request for recommendations, a vague trend aphorism, and pointers to external threads.",,,LOW,NEW,"Two threads are name-dropped as useful but their rules are NOT in this PDF: a TMA (Triangular Moving Average) strategy thread t=874421 (scherzi calls it 'a lot of ideas / interesting study field', says he does not follow it), and t=345838 (Empiric1 uses 'modified versions of a couple of the methods'). tiborf71's only rule-like statement is 'trade always in the direction of the trend and let the position run' -- too vague to mechanize. If harvesting the TMA edge is desired, source thread 874421 directly rather than this pointer thread."
STR-100,forums.babypips.com_risk-management-trading-plan_72307-optimal-f-towards-practical-application.html.pdf,1-4,"PhilipPirrip, ""Optimal f: Towards a Practical Application"" (with replies from Xskppy, azz33, mihk, ragzs), Risk Management Practices, BabyPips forum, 2015-2016, https://forums.babypips.com/t/optimal-f-towards-practical-application/72307",Optimal f position-sizing (money management only),"Position-sizing/capital-allocation discussion (Ralph Vince optimal f, Larry Williams risk-per-biggest-loss, fractional-deposit reset) with no trade signal.",FX,none,none,VAGUE,REJECTED,"No entry/exit edge — author explicitly confirms it is 'just a money management system and not a trade signal indicator'; nothing to backtest as a strategy, and optimal f's near-ruin drawdowns are also incompatible with FTMO/DXZ DD limits.",,,LOW,NEW,"Thread proposes a 'fraction of original investment' variant (deposit $1000, keep $9000 in bank, re-deposit after wipeout) as a drawdown workaround; still a bankroll scheme, not a signal. No parameters or rules for any market/timeframe."
STR-101,forums.babypips.com_t_1-500-pips-per-month-with-this-method-vsa-sr-fibb-etc_21084.pdf,"5, 33","petefader, ""1,500 PIPS PER MONTH with this method, VSA/SR/fibb etc"", babypips.com forums, 2009 (posts #9 and #136). https://forums.babypips.com/t/1-500-pips-per-month-with-this-method-vsa-sr-fibb-etc/21084",Volume-Spike Wick Rejection at S/R-Fib Level,"Fade a resistance or 50-61.8% fib level when price hits it and prints a candle with a >=40% rejection wick on a tick-volume spike, signaling smart-money absorption/exhaustion.",FX,M5,none,PARTIAL,ELIGIBLE,"Entry is a deterministic MQL5 primitive (tick volume available; wick-% + volume-vs-recent-range + proximity to level), no ML/external feed; but exits and the level definition are unspecified and must be operationalized.",,,LOW,NEW,"Rule stated twice verbatim: (1) move up to .50-.618 fib or resistance; (2) M5/M15 candle with >=40% wick on top + volume spike vs recent range; (3) enter short on reversal; mirror for longs. Variants: M15 anchor, M1 for finer scalp entry. Source is a 2009 discretionary trader repeatedly accused of running a paid signal room with zero posted track record; VSA-on-forex tick volume is disputed within the thread itself, and no SL/TP system is defined (trade examples use ad-hoc 20-pip SL / ~40-pip targets / lock-at-BE). Other ideas floated in-thread are too vague for rows: an undisclosed '1hr strategy, 90% win ratio' (never revealed), a range-breakout-via-volume-asymmetry read, and an MA5/MA-cross pullback (pete states he does not trade a strict crossover). Could rise to MED if reframed as a session-open exhaustion fade on JPY crosses (he traded GBPJPY/EURJPY/USDJPY across Asia->London->NY) with a defined ATR/fixed-pip stop."
STR-102,forums.babypips.com_t_10-pips-day-nbop_10624.pdf,4-6,"Thread ""10 pips / day (NBoP)"", author handle PIPology (MT4 indicator-setup help by Sweet_Pip), babypips.com Forex forum, 2008, https://forums.babypips.com/t/10-pips-day-nbop/10624 (full ruleset in posts #11 and #13; %R-vs-RSI-cross filter refined in posts #66/#100).",NBoP 10-pips/day EMA-MACD-%R momentum-pullback scalp,"On an 8-EMA(close)/13-EMA(open) cross confirmed by a MACD(13,21,8) zero-line cross within 4 bars, enter on a Williams %R(8) pullback (below -20 long / above -80 short) that is NOT crossing RSI(13,open), taking a fixed 10-pip target against a 10-pip+spread stop.",FX,M15,London,PARTIAL,ELIGIBLE,Mechanical core (EMA cross + MACD zero-cross within 4 bars + %R pullback + %R-not-crossing-RSI filter + fixed 10-pip TP + 10-pip/+spread SL + ~15-30min time exit + no-Friday) is fully specified and buildable in pure MQL5 on FX majors/JPY-crosses; only the hand-drawn trendline / previous-day linear-regression-channel breakout confirmation is discretionary and would be dropped or approximated as a fixed linreg-channel break.,,,LOW,NEW,"Original chart TF is 30M (nearest allowed enum = M15); trades resolve in 3-15 min which is finer than the signal TF (execution-granularity red flag). Fixed 1:1 R:R 10-pip scalp with spread eating the target = marginal net economics on spread-inclusive .DWX feed; classic indicator-confluence FX scalp with no structural limit-to-arbitrage edge (contra FX-Edge-Doctrine). Promotional context (blog/YouTube/feed, refuses template + account statement) and winning trades posted a day later (hindsight bias, called out in posts #115/#91) lower confidence but do not by themselves reject per forum-source rule. Pairs traded: EUR/USD, GBP/USD, USD/JPY, CAD/JPY (avoids AUD/USD, GBP/CHF, divergence days, news). Variant suggested by user enochbenjamin (#75): scale out at 10 pips, trail remainder at break-even. An undisclosed H4 'long trades' system is referenced (#77) but never specified -> not a candidate."
STR-103,forums.babypips.com_t_3-little-pigs-trading-system_54174.pdf,1-2,"harmonicphil et al., ""3 Little Pigs Trading System"", BabyPips forum thread, 2013, https://forums.babypips.com/t/3-little-pigs-trading-system/54174 — strategy originates from the free 'Forex Useful' (Jon) e-book/manual; SL detail p.1-2, ATR-symmetric TP EA variant p.13/17.",3 Little Pigs Multi-TF SMA Trend Swing,"Trade in the direction of three aligned timeframes: enter only when price is on the same side of the 55-SMA (Weekly), 21-SMA (Daily) and 34-SMA (H4).",FX,H4,none,FULL,ELIGIBLE,"Fully specified deterministic multi-TF SMA trend system on FX majors/crosses; implementable in pure MQL5, no ML, all data on .DWX (W1/D1/H4).",,,MED,NEW,"Entry: buy when Close>SMA55(W1) AND Close>SMA21(D1) AND an H4 candle touches then closes above SMA34(H4) (enter on that close); sell vice versa. SL = SMA34(H4) offset by 25%*(ATR14_high+ATR14_low) pips; trail behind SMA34. Pairs: AUDUSD,EURGBP,EURJPY,EURUSD,GBPUSD,USDCAD,USDCHF,USDJPY; risk 1%/trade; positions held over weekend. Exit variants (same core rules => one row): (a) OP author = trailing-stop-only, open target; (b) nicolas74 EA = symmetric ATR take-profit TP=Close+/-25%(ATRmin+ATRmax)+/-(Close-SMA34) over last 30 H4 bars; (c) kashif = fixed SL/TP. Caveats: generic triple-MA trend follower, choppy-market weak; multiple thread EA-builders reported inconsistent/negative results and that trailing-SMA stop and fixed SL both underperform, and one MT4 backtest had SL-not-hit coding bug (unreliable evidence). A paid MT4 confirmation indicator exists but is NOT required — all logic is stated. 'PAST' system name-dropped (p.2) but never specified."
STR-104,forums.babypips.com_t_a-scalping-day-trading-strategy-5minute-timeframe_1266726.pdf,1-2,"Eliteforexpartner, 'A Scalping/Day Trading strategy 5minute timeframe', forums.babypips.com, thread #1266726, 2024, https://forums.babypips.com/t/a-scalping-day-trading-strategy-5minute-timeframe/1266726",MACD-Campaign BB-Pullback Breakout Scalper,"A MACD zero-line cross sets trade direction ('campaign'); after price pulls back into a Bollinger Band, a buy/sell stop 1 pip beyond the pre-pullback swing extreme catches the momentum-continuation breakout.",FX,M5,none,FULL,ELIGIBLE,"Mechanical M5 breakout-after-pullback: MACD(6,17,1) zero-cross direction filter, Bollinger(10,shift 1,dev 0.66) pullback, stop order 1 pip past marked swing high/low, defined SL/TP variants (1:1 or 2:1) - pure MQL5, deterministic, defined stops, DXZ/FTMO-compatible.",,,LOW,NEW,"Low edge plausibility: promotional source (poster's blog link in bio), forum member TheodoreThring shows MACD-6/17/1 reduces exactly to an EMA-6/17 crossover, and tester DEAMON reports 'terrible results' / 'cannot be traded like this, needs filters'. Generic trend-continuation breakout, no distinctive uncorrelated driver. Three exit methods: M1 SL 1 pip below breakout candle at 1:1 RR, M2 SL 1 pip below lower band at 2:1 RR (both mechanical), M3 discretionary trend exit (wedge break / third-touch overshoot) - excluded as non-deterministic. 'Draw resistance at pre-pullback high' = swing/pivot-high detection, mechanizable. Wick-above-high without close = re-mark high (repeat step 3). Cancel unfilled stop order on opposite zero-line cross. Author claims it also works on indices and precious metals."
